Job Title,Job Description,Rating,Company Name,Location,Size,Founded,Type of ownership,Industry,Sector,Revenue,hourly,Employer Provided,min salary,max salary,avg salary,State,Age,Python,R,SQL,Machine Learning,Big Data,Statistique,Math,Master,AWS
DATA ANALYST / SCIENTIST (H/F) / Freelance,En binôme avec un développeur Java EE : - Participer à la quête des sources de données pertinentes - Extraire et traduire des données business en données statistiques - Participer à la modélisation et assurer les mises à jour régulières de la base de données - Contrôler la qualité des données - Analyser les informations chiffrées générées par l'activité de l'entreprise et de ses opérateurs clients - Synthétiser et vulgariser les informations pour les rendre accessibles - Proposer des recommandations sur les bases de données à modifier - Outil : Power BI,-1.0,FRISBEE PROFILING,Saint-Maur,De 1 à 50 employés,2016,Entreprise non cotée en bourse,Services informatiques,Informatique,Ne sait pas / non applicable,1,1,88,112,100.0,Saint-Maur,6,0,0,0,0,0,1,0,0,0
Data Scientist H/F,"nöus
umlaut, part of Accenture, est un partenaire mondial de bout en bout de 5000 personnes qui offre des services complets dans tous les secteurs d'activité et qui met en œuvre ses capacités de conseil et de réalisation interdisciplinaires et collaboratives pour améliorer le sort de ses clients et - en plus de cela - pour ajouter de la valeur, de la qualité et de l'attention à leurs organisations et à leurs produits.
notre öffre
vous participerez à la définition et au développement de nouveaux concepts et outils utilisés dans le traitement automatique et l'analyse des big data. Vous serez chargé(e) de :",3.7,"umlaut
",Blagnac,De 1 001 à 5 000 employés,1996,Entreprise non cotée en bourse,Conseils,Services aux entreprises,Ne sait pas / non applicable,0,1,45,45,45.0,Blagnac,26,0,0,0,0,1,0,0,0,0
Data Scientist (H/F),"Date Limite Candidature : lundi 14 mars 2022
Assurez-vous que votre profil candidat soit correctement renseigné avant de postuler. Les informations de votre profil complètent celles associées à chaque candidature. Afin d’augmenter votre visibilité sur notre Portail Emploi et ainsi permettre aux recruteurs de consulter votre profil candidat, vous avez la possibilité de déposer votre CV dans notre CVThèque en un clic !
Informations générales
Référence : UMR6205-EVAGOU-001
Lieu de travail : VANNES
Date de publication : lundi 21 février 2022
Type de contrat : CDD Scientifique
Durée du contrat : 24 mois
Date d'embauche prévue : 1 avril 2022
Quotité de travail : Temps complet
Rémunération : 2100 et 2400 €
Niveau d'études souhaité : Bac+5
Expérience souhaitée : Indifférent
l'évaluation d'indicateurs techniques permettant d'expliquer les variations des
actifs étudiés.
évolutions à court et moyen terme.
les modèles de gestions d'actifs développés.
sur les marchés de cryptomonnaies sous des délais courts (de l'ordre d'une
dizaine de secondes), et ce, en s'adaptant aux données observées en continue.
de machine learning ;
sein du laboratoire LMBA (Vannes).",3.8,"CNRS
",Vannes,Plus de 10 000 employés,1939,Enseignement supérieur/universitaire,Organismes fédéraux,Gouvernement,Entre 50 et 100 millions de dollars US,0,1,25,29,27.0,Vannes,83,0,1,0,1,0,0,0,0,0
Data Scientist H/F,"Informations générales

La Direction Générale du Soutien Militaire (DGSM) assure la mise en œuvre et la maintenance des avions militaires et de leur environnement avec un soutien personnalisé pour chaque client.
La composante Transformation Numérique participe au développement, à la mise en œuvre et au déploiement de l'environnement Big Data Militaire. Cet environnement a pour objectif d'aider à l'amélioration de la disponibilité de nos avions et est une composante incontournable des contrats de maintenance passés avec nos clients militaires.
Au sein de l'équipe Transformation Numérique vous participez aux travaux de Data Science visant à la définition de la maintenance prévisionnelle pour optimiser au travers d'algorithmes la disponibilité de nos avions militaires (Rafale, M2000, ATL).

Au travers d'outils de Data Science (python, spark) et d'un Big Data Studio vous serez chargé de :


Vous êtes force de proposition dans l'évolution du Big Data Studio.
Vous travaillez en mode projet avec les équipes métier de la DGSM et de la R&D. L'intégration des personnes de plusieurs directions permettant de combiner les aspects Métier du soutien, Data Science et Informatique.

Vous serez également responsable du développement des compétences Data Science de la DGSM et contribuerez à la communauté IA/ Data Science Dassault Aviation.",3.7,"Dassault Aviation
",Saint-Cloud,Plus de 10 000 employés,1929,Entreprise cotée en bourse,-1,-1,-1,0,0,36,54,45.0,Saint-Cloud,93,1,1,0,0,1,0,0,0,0
DATA SCIENTIST CYBERSECURITE H/F,"Contrat : CDI
Rémunération : Selon profil
Lieu : Toulouse et Paris
ITrust cherche ses JEDI !
Start-up devenue grande, ITrust est le leader européen en Intelligence artificielle appliquée à la cybersécurité défensive : véritable incubateur de talents, ITrust est à la fois expert en sécurité (conseil, audit, RedTeam, MSSP, formation) et éditeur de logiciels innovants avec IKare (scanner de vulnérabilités) et Reveelium (SIEM détecteur d’attaques inconnues, APT (Advanced Persistent Threat) et comportements malveillants par Machine Learning).
Résolument tournée vers l’international ITrust poursuit son développement avec l’ouverture de 2 nouveaux terrains de jeux : une école, l’AN21 pour former de jeunes padawans et un centre de recherche en IA pour contrer la « Menace Fantôme ».
Véritable visionnaire, à l’image de sa direction et de ses collaborateurs l’entreprise est animée par la passion des sujets de la cybersécurité et de l’intelligence artificielle.
ITrust est une entreprise innovante qui propose un environnement de travail stimulant et dynamique au sein d’une équipe d’experts drivés par un sentiment de convivialité, de solidarité et de confiance. Ces derniers ont toutes les cartes en main pour servir leurs propres ambitions et celles de l’entreprise.
Au-delà de son département de Professional services, SOC (Security Operations Center) et de Recherche & Développement, ITrust c’est aussi et surtout une famille, à la recherche de ses futurs membres !

Vous serez amené à intervenir et à développer vos compétences sur les thématiques suivantes :",2.7,"ITrust
",Toulouse,De 1 à 50 employés,2007,Entreprise non cotée en bourse,Services informatiques,Informatique,Moins d''un million de dollars US,0,0,36,55,45.5,Toulouse,15,0,1,0,1,0,0,0,0,0
"Data Scientist (full time, all seniority levels) - QuantumBlack","Who You'll Work With
Based in Paris and working across the region, as a consultant data scientist you will work closely with our clients, data engineers and all types of McKinsey consultants on interdisciplinary projects, using maths, stats and machine learning to derive structure and knowledge from raw data across various industry sectors.
This hybrid client-facing/technical role will allow you to use state of the art technologies to solve highly impactful business problems, whilst also leveraging your strong communication skills to convey complex intractable ideas to non-technical audiences.
Who you are",4.4,"McKinsey & Company
",Paris,Plus de 10 000 employés,1926,Entreprise non cotée en bourse,Conseils,Services aux entreprises,Ne sait pas / non applicable,0,0,70,89,79.5,Paris,96,0,0,0,1,0,0,1,0,0
Data Scientist (F ou H),"Les équipes Transilien de SNCF offrent un service complet à 3 millions de voyageurs quotidiens dans 381 gares d’Ile-de-France, sur 14 lignes ferrées et 16 lignes de bus Noctilien.
Vos missions
Au sein de Transilien, les collaborateurs de de la DSI ont pour objectif d’apporter des services numériques innovants pour contribuer aux enjeux du groupe SNCF en construisant les SI de demain et en les maintenant opérationnels. L’équipe Big DATA Transilien a pour mission de réaliser les applications qui font appel aux technologies Big Data et Data Viz pour les différents métiers de Transilien (Info Voyageurs , Production ou distribution) . Elle gère à la fois le BUILD et le RUN de ces applicatifs, dont l’exploitation est assurée par DEA.",3.5,"SNCF
",Saint-Denis,Plus de 10 000 employés,1938,Entreprise cotée en bourse,-1,-1,-1,0,0,36,54,45.0,Saint-Denis,84,0,1,0,0,1,0,0,0,0
Data Scientist (H/F),"Syngenta figure parmi les leaders mondiaux pour ses activités. Le groupe emploie plus de 28000 personnes dans plus de 90 pays qui n’ont qu’un seul objectif: exprimer le potentiel des plantes. Par nos capacités scientifiques de premier plan, notre présence mondiale et notre engagement en faveur des clients, nous aidons à accroître les rendements et la rentabilité des cultures, à protéger l’environnement et à améliorer la santé et la qualité de vie.
Plus d’informations sur www.syngenta.com
Nous recherchons un(e) Data Scientist, pour rejoindre l’équipe Support Commercial et Planning dans le cadre d’un CDI. Nous vous attendons pour un démarrage dans les meilleurs délais. Le poste est localisé à Guyancourt (station Saint Quentin en Yvelines, RER C, Ligne U et N).",4.2,"Syngenta
",Guyancourt,Plus de 10 000 employés,2000,Entreprise non cotée en bourse,Production alimentaire,Agriculture et sylviculture,Entre 10 et 25 millions de dollars US,0,0,42,78,60.0,Guyancourt,22,0,1,0,0,0,0,0,0,0
Audio data scientist,"Vous aimez les nouvelles technologies et les technologies audio en particulier? Venez rejoindre une équipe d’experts de haut niveau appliquant les technologies de machine learning pour le traitement sonore.
Afin de développer son offre d’application d’outils de reconnaissance sonore, Wavely recherche un data scientist pour rejoindre son équipe technique. Celle-ci est dédiée au développement d’algorithmes de reconnaissance et de classification automatique des signaux sonores pour les intégrer au sein de capteurs acoustiques. Au sein de cette équipe :
Vous développez des outils de traitement du signal temps-réel pour la détection et la classification d’événements acoustiques.",4.5,"Wavely SAS
",Villeneuve-d'Ascq,De 1 à 50 employés,2016,Entreprise non cotée en bourse,Solutions logicielles et réseau d''entreprise,Informatique,Ne sait pas / non applicable,0,1,35,60,47.5,Villeneuve-d'Ascq,6,0,0,0,1,0,0,0,0,0
Data Scientist,"Gather and analyze customer needs to propose solutions
Conduct statistical studies
Conduct research to propose new machine learning models to improve the results of predictive and imaging models
Work with all team members to prototype and develop new services
Provide deliverables such as PoCs, presentations, and technical papers.
yöu
Master's degree in engineering, computer science, statistics or mathematics.",3.7,"umlaut AG
",Toulouse,De 1 001 à 5 000 employés,1996,Entreprise non cotée en bourse,Conseils,Services aux entreprises,Ne sait pas / non applicable,0,0,33,40,36.5,Toulouse,26,0,0,0,1,0,1,1,1,0
Data Analyst-FIAT,"Binance is the global blockchain company behind the world’s largest digital asset exchange by trading volume and users, serving a greater mission to accelerate cryptocurrency adoption and increase the freedom of money.

Are you looking to be a part of the most influential company in the blockchain industry and contribute to the crypto-currency revolution that is changing the world?
Responsibilities:
Working closely with different stakeholders (e.g. Operation, Business, Product, etc.) to develop analyses that lead to actionable business or product insights",3.8,"Binance
",Paris,De 1 001 à 5 000 employés,2017,Entreprise non cotée en bourse,Internet,Informatique,Entre 500 millions et 1 milliard $ (USD),0,0,43,55,49.0,Paris,5,0,1,0,0,0,0,0,0,0
Data Scientist NLP (F/M/X) - CDI,"Jellysmack is the global creator company that detects and develops the world's most talented video creators on social media. We're an optimistic crew who naturally goes the extra mile, has a glass-half-full mindset, and sees challenges as opportunities. We look for positive people who think outside the box, are inventive, bold, lead change, and believe that teamwork matters.
Team culture:
Our job is to take numbers and turn them into reasons to celebrate! Data drives everything we do at Jellysmack and is thus essential to the company. Data is at the heart of our success, and it drives the content we create and how we edit videos so we can optimize everything we publish. Everyone on our team is capable of going above and beyond the call of duty. Our goal is to gather and analyze data to help the company grow. Do you have what it takes to be part of our team?",4.1,"Jellysmack
",France,De 501 à 1 000 employés,2016,Entreprise non cotée en bourse,Internet,Informatique,Ne sait pas / non applicable,0,0,35,40,37.5,France,6,0,0,0,0,0,0,0,0,0
#AGGP – Graduate Digital Master Data & Controlling Data Analyst (M/F),"Job Description:
Start date October 3rd 2022
Every year we look for university graduates from around the world to join Airbus. We need people with the aspiration, enthusiasm and the talent to help us move forward and to change the world and deliver our vision to pioneer sustainable aerospace for a safe and united world.
When you begin your career with us, we accelerate your development through our Airbus Global Graduate Experience. You are part of a 2 year programme where you develop your professional skills, build your networks, locally and internationally, and gain a unique perspective on the world of Airbus. You are part of a global community, so we bring you together once a year for a global graduate conference where you meet your peers, hear from our leaders and learn from the best.
We are hiring the graduates we need to fill the critical roles for our future.
AIRBUS SAS
Permanent Contract / CDI / Unbefristet / Contrato indefinido
Entry Level / Débutant / Anfänger / Recién titulado
Financial Expertise <JF-FI-FE>",4.1,"Airbus
",Toulouse,Plus de 10 000 employés,1970,Entreprise cotée en bourse,Aérospatiale et Défense,Aérospatiale et Défense,Plus de 10 milliards de dollars US,0,0,35,40,37.5,Toulouse,52,0,1,0,0,0,0,0,0,0
Data analyste,"Description
vrai plus, c’est que cette communauté est sans frontières ! Nos collaborateurs travaillent au quotidien avec tous les métiers et avec notre réseau international. Et pour être au top de l’innovation, on a ce qui se fait de mieux en matière d’environnement de travail et d’outils technos : datalab, delta room, intelligence artificielle, machine learning…
Résultats ? Une activité multipliée par 2 en 3 ans (et ce n’est pas fini), une expertise reconnue et une position de leader en France.
Bienvenue au cœur du big bang !
Le Centre de Services Data Management
Tu souhaites monter en compétences sur le traitement de datas ? Et si tu rejoignais le centre dédié à l’analyse de données/data management de PwC ?

L’équipe SODA basée à Montpellier est un Centre de Services Data Management d’une cinquantaine de collaborateurs en période de pic d’activité pour une moyenne de 40 à 45 collaborateurs, principalement composée Data Analystes et complétée par des développeurs de haut niveau.
Tout au long de l’année, SODA accompagne les équipes Audit PwC dans l’efficacité et la qualité des missions en proposant des services de traitement des données.",3.8,"PwC
",Montpellier,Plus de 10 000 employés,1998,Entreprise non cotée en bourse,Conseils,Services aux entreprises,Entre 5 et 10 milliards de dollars US,0,0,35,40,37.5,Montpellier,24,0,1,0,1,0,0,0,0,0
Data Scientist confirmé(e) H/F,"Systèmes d'Information
PAU-CSTJF(FRA)
France
Description du poste
TotalEnergies recherche un(e) Data Scientist confirmé(e). Le poste est basé à Pau.

Vous travaillez au sein du département Data Valorisation de TotalEnergies Global Information Technology Services (TGITS), le centre de services mutualisés Système d'information de TotalEnergies.

Dans un contexte de mutation technologique rapide et de transformation digitale de la Compagnie vous développez des modèles machine learning et deep learning sur des données telles que des images sismiques, des données time series d’équipements de mesure industrielle, ou des rapports d'études.

Au sein du DataLab, équipe pluridisciplinaire travaillant exclusivement sur des projets Data Sciences, vos principales missions sont les suivantes :",4.0,"TotalEnergies
",Pau,Plus de 10 000 employés,1924,Entreprise cotée en bourse,Énergie,"Pétrole, gaz, énergie et services publics",Entre 25 et 50 millions de dollars US,0,0,35,40,37.5,Pau,98,0,1,0,1,0,0,0,0,0
Data Analyst H/F,"« SAFTI, ça le fait ! », vous avez probablement entendu ça quelque part…

Depuis 2015 SAFTI mène de puissantes campagnes télévisées sur les plus grandes chaînes : TF1, M6, BFM TV, etc.

Créé en 2010, autour d’un concept novateur, SAFTI a réinventé le domaine de l’immobilier en ayant fait le pari de l’absence d’agence physique à la faveur d’un maillage du territoire par des conseillers en immobilier, exerçant depuis leur domicile grâce aux nouvelles technologies.

SAFTI est ainsi devenu en moins de 10 ans l’un des acteurs majeurs du marché de l’immobilier en France :",4.1,"Safti siège
",Toulouse,De 1 001 à 5 000 employés,2010,Entreprise non cotée en bourse,Immobilier,Immobilier,Ne sait pas / non applicable,0,0,35,40,37.5,Toulouse,12,0,0,0,0,0,0,0,0,0
Data analyste & coordinateur Pacte Eco Efficace PEE F/H,"Stratégie Economie Business, Systèmes d'Information, Commerce
COURBEVOIE(PLD)-MISSION MARCHAND(FRA)
France
Description du poste
Vous souhaitez concilier la force d'un grand Groupe et l'agilité d'une petite entreprise ? Rejoignez TotalEnergies Lubrifiants Services Automobile, filiale à taille humaine, agile et performante !

Nous recrutons un(e) Data Analyste Marketing et coordinateur Pacte Eco Efficace PEE F/H afin de rejoindre le département Marketing de TotalEnergies Lubrifiants Services Automobile - TLSA

En relation constante avec sa hiérarchie, TEMF et les différents prestataires, le Data Analyste assure la mise en place, la gestion et le suivi des campagnes de signatures CEE et la valorisation des cumacs.et réalise des études de marketing stratégiques visant à améliorer notre offres",4.0,"TotalEnergies
",Courbevoie,Plus de 10 000 employés,1924,Entreprise cotée en bourse,Énergie,"Pétrole, gaz, énergie et services publics",Entre 25 et 50 millions de dollars US,0,0,35,40,37.5,Courbevoie,98,0,1,0,0,0,0,0,0,0
Data Analyst,"Description de l'entreprise*
Qui sommes-nous ?*
Ysance est une société spécialisée dans la data créée en 2005. Nous faisons partie du groupe Devoteam, leader du conseil en stratégie digitale, plateformes technologiques et cybersécurité.
Nous sommes organisés en deux communautés très complémentaires : Tech for Data (engineering & architecture) et Data for Business (data science, viz, data analytics). Nos équipes accompagnent les entreprises pour faire de la data un accélérateur business. Cet accompagnement couvre à la fois les problématiques de gestion de la data dans des environnements « on premise » mais également un fort savoir-faire dans les sujets de move to cloud ; Ysance s’appuyant sur les capacités de* Devoteam, leader sur le cloud avec des partenariats de référence sur GCP, AWS, Azure, …*
Dans le cadre de notre développement, nous renforçons nos équipes !

Ysance a développé un programme solide de formations & certifications (partenariats avec …), notamment sur les technologies cloud (, …)
Ysance intervient dans de (Retail, luxe, média, télécoms, banque, industrie, …) pour des grands comptes internationaux
La garantie d’intervenir sur des sujets précis au cœur de votre expertise
Ysance c’est avant tout une bénéficiant de* l’écosystème d’un grand groupe*",3.6,"Ysance
",Levallois-Perret,De 51 à 200 employés,2007,Entreprise non cotée en bourse,-1,-1,-1,0,0,35,40,37.5,Levallois-Perret,15,0,1,0,0,0,0,0,0,1
Data Analyst - Environnement,"Afin de continuer le développement de notre structure spécialisé dans l’accompagnements de collectivités ou d’acteurs privés de la gestion des déchets, nous recherchons un(e) chef(fe) de projets data pour apporter cette compétence au sein de notre équipe.
Vous rejoindrez une équipe pluridisciplinaire et serez amené(e) à gérer et/ou accompagner des projets dans le secteur porteur l’économie circulaire plus particulièrement lié à la collecte des déchets.
Alors si vous souhaitez mettre vos compétences techniques au service de projets qui ont du sens, ce poste est fait pour vous !!

Vous serez ainsi en charge de :",3.3,"Groupe Berto
",Aix,De 1 001 à 5 000 employés,1963,Entreprise non cotée en bourse,Camionnage,Transport et logistique,Entre 100 et 500 millions de dollars US,0,0,35,40,37.5,Aix,59,0,0,0,0,0,0,0,0,0
Data Scientist - FRANFINANCE-(H/F),"Vos missions au quotidien
Au sein de la Direction Datascience Marketing et Modélisation de la Division du Financement aux Particuliers, qui produit et distribue des crédits et des services auprès de particuliers en direct ou par l’intermédiaire de partenaires (distributeurs, assureurs, banquiers et fintech), vous rejoignez le pôle Datascience et Risque en tant que Data Scientist.
Le Data Scientist aura la charge de :
Assurer et faire évoluer nos reportings distribués aux différentes directions de FRANFINANCE (risque, finance, recouvrement, marketing) et à nos partenaires",3.9,"Franfinance
",Nanterre,Plus de 10 000 employés,1864,Entreprise non cotée en bourse,Investissements bancaires et gestion d''actifs,Finances,Plus de 10 milliards de dollars US,0,0,35,40,37.5,Nanterre,158,0,1,0,0,0,0,0,0,0
Data Scientist II,"JOB DESCRIPTION
At Levi Strauss & Co, we are revolutionizing the apparel business and redefining the way denim is made.

We are taking one of the world’s most iconic brands into the next century:
from creating machine learning-powered denim finishes to using block-chain for our factory workers’ wellbeing, to building algorithms to better meet the needs of our consumers and optimize our supply chain.

Be a pioneer in the fashion industry by joining our global Data, Analytics & AI “startup with “assets,” where you will have the chance to build exciting solutions that will impact our business and at the same time be part of a bigger, across-continents, data science community.

As a P romotion Data Scientist you will be a key part of the Data, Analytics and AI team and will create advanced analytics, machine learning, and AI solutions to better solve Pricing and Promo problems while streamlining our processes and approaching the business in more innovative ways.

In this role, you will translate the needs of our cross-functional stakeholders into predictive models and actionable insights that will drive revenue and/or reduce cost, with emphasis on automation and business process improvement.

You will contribute to the global Data, Analytics & AI community, share your knowledge and leverage other colleagues’ experience.

About the job





Paris, France
Full time",3.3,"Levi Strauss & Co.
",Paris,Plus de 10 000 employés,1853,Entreprise cotée en bourse,"Magasins de chaussures, de vêtements et grands magasins",Vente au détail,Entre 2 et 5 milliards de dollars US,0,0,35,40,37.5,Paris,169,0,1,0,1,0,0,0,0,0
Data scientist,"DATA SCIENTIST H/F
MARSEILLE (13) – WITMONKI SAS
Publiée le : 01/07/2019
RESUME DE L'OFFRE
Type de contrat CDD
Lieu MARSEILLE (13)
Type d’offre Industrie
Expérience requise 2 ans",-1.0,WitMonki,Marseille,-1,-1,-1,-1,-1,-1,0,0,35,40,37.5,Marseille,-1,0,1,0,0,0,0,0,0,0
Data Scientist F/H,"Data Scientist F/H
Ref. Apec : 167730138W
UMLAUT
2
CDI
Blagnac - 31
Publiée le 24/02/2022
Actualisée le 24/02/2022
Salaire
A négocier",3.7,"UMLAUT
",Blagnac,De 1 001 à 5 000 employés,1996,Entreprise non cotée en bourse,Conseils,Services aux entreprises,Ne sait pas / non applicable,0,0,35,40,37.5,Blagnac,26,0,1,0,0,0,0,0,0,0
Data scientist Junior F/H,"L'entreprise

Leader de son marché, le Groupe PRIMEVER développe des solutions dans les domaines du transport et de la logistique auprès de ses clients, concentrés sur deux secteurs d’activités particuliers : Le primeur (fruits/légumes) et l’industriel.
Rejoindre PRIMEVER, c’est intégrer un Groupe familial de plus de 2500 collaborateurs, 50 sites, fort de ses valeurs et en plein développement grâce à l’implication quotidienne de son personnel.
Rejoignez-nous !",3.4,"Réseau Primever France
",Agen,De 1 001 à 5 000 employés,1963,Entreprise non cotée en bourse,-1,-1,-1,0,0,35,40,37.5,Agen,59,0,1,0,0,0,0,0,0,0
