Job Title,Job Description,Rating,Company Name,Location,Size,Founded,Type of ownership,Industry,Sector,Revenue,hourly,Employer Provided,min salary,max salary,avg salary,State,Age,Python,R,SQL,Machine Learning,Big Data,Statistique,Math,Master,AWS
Data Scientist F/H,"Chez CBA, on a envie de t’étonner et de t’assurer qu’avec nous tu seras bien entouré.e, plongé.e dans un esprit « start up » où se mêle challenges, créa et bonne humeur. Tu es passionné.e, ça tombe bien nous aussi !

Dans le cadre de notre croissance, nous recherchons notre Data Scientist F/H pour intégrer notre Team Produit.

En quoi consiste la mission ?

Rattaché.e au Directeur Produit, ta mission, si tu l’acceptes, sera de recueillir, traiter et analyser les données ""Big Data"" afin d'accompagner les décisions stratégiques et opérationnelles de CBA.

Concrètement, voici les missions qi t'attendent :
Un peu plus de détails sur le contrat ?

Si tu rejoins l’aventure CBA, nous te proposons un poste en CDI ainsi que des avantages et services non négligeables, dont, mutuelle, tickets restaurant, activités CSE, une belle participation, des cours de sport, des ateliers bien-être et plusieurs événements « fun » tout au long de l’année pour renforcer la cohésion d’équipe et partager les savoirs.

Côté technique, nous t'accompagnons en mettant à ta disposition les formations nécessaires pour assurer ta parfaite adaptation à notre écosystème, nos outils et nos pratiques mais aussi pour participer à ta montée en compétences.


- Méthodologie SCRUM et outils associés",3.7,"CBA Informatique Libérale
",Avignon,De 51 à 200 employés,1994,Entreprise non cotée en bourse,-1,-1,-1,0,0,35,40,37.5,Avignon,28,0,1,0,0,1,0,0,0,0
Data Analyst Junior (H/F),"Pour renforcer la capacité de Winamax à exploiter et faire parler les données relatives à nos clients et à nos activités poker et paris sportifs, nous recrutons un Data Analyst Junior (H/F).
Au sein de l’équipe Customer Relationship Management et sous la responsabilité du CRM manager, tu as un rôle clé dans valorisation et le partage de la donnée clients et produits en interne.
Tu as un réel intérêt pour les problématiques business / marketing et tu souhaites approfondir une première expérience réussie en data analysis.
Tes missions seront de :
Comprendre les comportements clients dans le but d’en tirer des enseignements à forte valeur ajoutée,",4.2,"Winamax
",Paris,Entre 201 et 500 employés,2006,Entreprise non cotée en bourse,Jeux d''argent,"Arts, spectacles et loisirs",Entre 100 et 500 millions de dollars US,0,0,35,40,37.5,Paris,16,0,1,0,0,0,0,0,0,0
Analyste Data et Business H/F,"Systèmes d'Information, Commerce
PARIS-RUE LOUIS ARMAND(FRA)
France
Description du poste
Rattaché(e) à la Performance Opérationnelle du Centre de Services des activités B2C, vous prenez en charge les missions suivantes :
Construire et optimiser des outils d’analyses et de pilotage des ventes B2C sur Qlik Sense (rapports de ventes, caractéristiques clients, suivi des options, états de rémunération, contrôle qualité…) :
o Recueillir les besoins du Métier",4.0,"TotalEnergies
",Paris,Plus de 10 000 employés,1924,Entreprise cotée en bourse,Énergie,"Pétrole, gaz, énergie et services publics",Entre 25 et 50 millions de dollars US,0,0,35,40,37.5,Paris,98,0,1,0,0,0,0,0,0,0
Data Scientist & Mapping Specialist (m/f),"Job Description:
Job description
Embedded in the Geospatial Solution Development team, the Data Scientist & Mapping is responsible for the end-to-end development, specification, monitoring and maintenance of satellite data science workflows and processing algorithms/ analytics, addressing diverse use cases in multiple verticals market. This position is open in TOULOUSE, France.
As Data Scientist & Mapping Specialist you will define and deliver the foundation layers of the 2D and 3D environment, generate topographic maps and vector database leveraging high-end satellite data and derive thematic maps such as aeronautical obstacles, land use to fuel our existing and future geospatial solutions addressing commercial and defence use cases (air mobility, low level flights, simulation, eTOD, land management, urban planning, green islands, environmental impact assessment & monitoring, etc..
Airbus DS Geo SA
Permanent Contract / CDI / Unbefristet / Contrato indefinido
Professional / Expérimenté(e) / Professionell / Profesional
Information Mgmt and Digital Technology <JF-IM-DI>",4.1,"Airbus
",Toulouse,Plus de 10 000 employés,1970,Entreprise cotée en bourse,Aérospatiale et Défense,Aérospatiale et Défense,Plus de 10 milliards de dollars US,0,0,35,40,37.5,Toulouse,52,0,0,0,0,0,0,0,0,0
Ingénieur Data Science H/F,"Type de contrat :
CDI

Niveau de formation :
BAC +4 / BAC +5

Spécialité(s) :
Recherche & Développement

Pays / Région :
France

Ville :
PALAISEAU",4.0,"EDF
",Palaiseau,Plus de 10 000 employés,1946,Entreprise cotée en bourse,Énergie,"Pétrole, gaz, énergie et services publics",Plus de 10 milliards de dollars US,0,0,35,40,37.5,Palaiseau,76,0,1,0,0,0,0,0,0,0
Data Scientist Time Series (F/M/X) - CDI,"Jellysmack is the global creator company that detects and develops the world's most talented video creators on social media. We're an optimistic crew who naturally goes the extra mile, has a glass-half-full mindset, and sees challenges as opportunities. We look for positive people who think outside the box, are inventive, bold, lead change, and believe that teamwork matters.
Team culture:
Our job is to take numbers and turn them into reasons to celebrate! Data drives everything we do at Jellysmack and is thus essential to the company. Data is at the heart of our success, and it drives the content we create and how we edit videos so we can optimize everything we publish. Everyone on our team is capable of going above and beyond the call of duty. Our goal is to gather and analyze data to help the company grow. Do you have what it takes to be part of our team?",4.1,"Jellysmack
",France,De 501 à 1 000 employés,2016,Entreprise non cotée en bourse,Internet,Informatique,Ne sait pas / non applicable,0,0,35,40,37.5,France,6,0,0,0,0,0,0,0,0,0
Data analyst campagne publicitaire Pinterest à Lisbonne (f/h/x),"Vous êtes francophone, passionné par le marketing digital et avez un esprit analytique ? Travaillez avec Pinterest et lancez-vous dans ce nouveau défi !
En tant qu’analyste publicitaire, votre rôle sera d'analyser les données des campagnes marketing numérique de notre client dans le but d’optimiser leur profit.
Vous travaillerez sur le marché français et contribuerez à créer une meilleure expérience pour les utilisateurs. Êtes-vous prêt ?

Notre Client
Pinterest constitue le meilleur moteur de recherche visuelle dans le monde utilisé par plus de 300 millions de personnes. C'est une plateforme de partage d'idées et de créativité et aussi, l'endroit idéal pour trouver les produits et les marques les plus innovants, trouver l'inspiration et rêver.",3.9,"Teleperformance Portugal
",France,Plus de 10 000 employés,1978,Entreprise cotée en bourse,Recrutement et sous-traitance,Services aux entreprises,Entre 5 et 10 milliards de dollars US,0,0,35,40,37.5,France,44,0,0,0,0,0,0,0,0,0
Alehos Services - Data Analyst performance - H/F,"Présentation du Groupe

Air Liquide est un leader mondial des gaz, technologies et services pour l’industrie et la santé. Présent dans 80 pays avec environ 67 000 collaborateurs, le Groupe sert plus de 3,7 millions de clients et de patients. Oxygène, azote et hydrogène sont des petites molécules essentielles à la vie, la matière et l’énergie. Elles incarnent le territoire scientifique d’Air Liquide et sont au cœur du métier du Groupe depuis sa création en 1902.
Air Liquide a pour ambition d’être un leader de son industrie, d’être performant sur le long terme et de contribuer à un monde plus durable.
Air Liquide place la diversité au cœur de ses activités et s'engage notamment en favorisant l’égalité professionnelle et l’emploi des travailleurs en situation de handicap.









Job Reference: FR13911",3.8,"Air Liquide
",Aix,Plus de 10 000 employés,1902,Entreprise cotée en bourse,Fabrication de produits chimiques,Fabrication,Plus de 10 milliards de dollars US,0,0,35,40,37.5,Aix,120,0,1,0,0,0,0,0,0,0
Google Data Scientist (H/F),"A propos d’Atos

Atos est un leader international de la transformation digitale avec 107 000 collaborateurs et un chiffre d’affaires annuel de plus de 11 milliards d’euros. Numéro un européen du cloud, de la cybersécurité et des supercalculateurs, le Groupe fournit des solutions intégrées pour tous les secteurs, dans 71 pays. Pionnier des services et produits de décarbonation, Atos s’engage à fournir des solutions numériques sécurisées et décarbonées à ses clients. Atos est une SE (Société Européenne) cotée sur Euronext Paris et fait partie des indices CAC 40 ESG et Next 20.

La raison d’être d’Atos est de contribuer à façonner l’espace informationnel. Avec ses compétences et ses services, le Groupe supporte le développement de la connaissance, de l’éducation et de la recherche dans une approche pluriculturelle et contribue au développement de l’excellence scientifique et technologique. Partout dans le monde, Atos permet à ses clients et à ses collaborateurs, et plus généralement au plus grand nombre, de vivre, travailler et progresser durablement et en toute confiance dans l’espace informationnel.


De formation type Bac+5 en école d’ingénieur ou équivalent

Bon niveau en Anglais requis


De formation type Bac+5 en école d’ingénieur ou équivalent

Expérience des codings game python, challenge kaggle,....

Expériences réussites dans les projets Data Science pour les grands comptes

Connaissance approfondie des algorithmes de Data Science et au moins une expérience réussie dans le développement d’un modèle de Machine Learning

Maîtrise des langages de traitement de données (R, SQL, Python, etc.)

Connaissance des technologies et services Cloud (GCP, Azure, AWS, etc.)

Aisance pour travailler sur des technologies on-premise (e.g. Hadoop, Scala) ou Cloud

Aisance pour travailler sur la plateforme de data science Dataiku

Forte curiosité technique et force de proposition dans la sélection des modèles

Excellentes capacités de communication, de storytelling et de vulgarisation pour partager les avancées techniques lors des réunions d’équipe

Rigueur, autonomie et capacité à travailler en équipe dans un environnement de travail exigeant

Expérience des projets en mode agile (backlog, sprint planning, sprint demo, etc.)


Expérience avec Google Cloud Platform, en particulier BigQuery

Connaissance des frameworks de deep-learning (e.g. TensorFlow)

Votre dynamisme et votre rigueur sont gages de réussite pour évoluer dans un nouveau poste. Vous avez l’esprit d'équipe, passionné(e) par les technologies de pointe, vous êtes autonome, rigoureux et avez le sens de la communication.

Chez Atos, nous voulons que nos employés se sentent valorisés, appréciés et libres d'être eux-mêmes au travail. Nos process RH sont conçus pour prévenir la discrimination envers l'identité ou l'orientation sexuelle, la religion, l’origine ethnique, l'âge, la neurodiversité, le handicap, la citoyenneté ou tout autre aspect qui rend nos collaborateurs uniques. Partout dans le monde, nous avons créé plusieurs programmes pour soutenir la culture inclusive d'Atos, et nous travaillons pour nous assurer que tous nos collaborateurs aient une chance égale de sentir qu'ils sont exactement là où ils doivent être.",3.6,"Atos
",Lille,Plus de 10 000 employés,1997,Entreprise cotée en bourse,Services informatiques,Informatique,Plus de 10 milliards de dollars US,0,0,35,40,37.5,Lille,25,1,1,1,1,0,0,0,0,1
Data Analyst (H/F),"France
Descriptif de poste
Venez exprimer vos talents IT chez Volvo Group ! Vous évoluerez au sein de l’équipe Data & Analytics qui attend avec impatience son/sa nouveau/nouvelle Data Analyst pour son site de Lyon.

La Data chez Volvo Group c’est quoi ?

C’est une entité au sein de Volvo Group Digital & IT dont le but est de libérer la puissance des données pour que l'ensemble du groupe devienne une entreprise entièrement « data driven » !

Avec l’équipe Data, nous concrétisons la vision 2030 du groupe Volvo. Nous nous occupons de tous les aspects de la data : qualité, documentation, mises à disposition, et visualisation via des outils de business Intelligence et de data science.

Nous avons devant nous une transformation ambitieuse, avec une mise en place de l’ensemble des solutions BI et data science sur Azure ainsi que le renforcement de la Data Governance et de la Data Management dans l'ensemble du Groupe.
250 personnes sont dédiées à la Data à travers le monde (Suède, Pologne, Belgique, US, Inde, France) dont une quarantaine de super équipiers en France



Au sein de nos équipes, vous êtes responsable en tant que Data Analyst de supporter l’implémentation de solutions BI & Advanced Analytics sur le périmètre Renault Trucks du groupe Volvo. Votre rôle est d’intervenir sur un portefeuille de projets et maintenances diversifiés :
Et bien sûr, vous bénéficierez de formations dédiées pour entretenir et développer vos compétences techniques et fonctionnelles.



Vous pensez data, vous rêvez data ? C’est un très bon début !",4.2,"Volvo Group
",Lyon,Plus de 10 000 employés,1927,Entreprise cotée en bourse,Fabrication d''équipement de transport,Fabrication,Plus de 10 milliards de dollars US,0,0,35,40,37.5,Lyon,95,0,1,0,0,0,0,0,0,0
ACTUAIRE / DATA SCIENTIST / STATISTICIEN - ASSURANCE NON-VIE (H/F),"Présentation de la société
Depuis 1971, nous imaginons, concevons et orientons les offres et services qui contribuent au développement de l’activité assurance du Crédit Mutuel, inventeur du concept de bancassurance.

Les Assurances du Crédit Mutuel sont présentes sur les marchés des assurances de biens, de personnes comme de l’assurance-vie, et nous proposons des solutions innovantes à tous ceux qui désirent se protéger et anticiper demain.
C’est notre philosophie pionnière, humaine et innovante qui guide nos actions et nos décisions. Loin de nous contenter d’assurer les risques auxquels font face nos assurés aujourd’hui, nous cherchons au quotidien à prévenir les risques futurs et à construire une assurance de demain plus juste.
Les Assurances du Crédit Mutuel, c’est plus de 3 700 talents au service de plus 13 millions d’assurés générant un chiffre d’affaires de 12,1 milliards d’euros ce qui nous place parmi les acteurs majeurs de l’assurance et de la protection sociale en France.

Rejoindre les Assurances du Crédit Mutuel, c’est rejoindre une entreprise dans laquelle l’humain et son potentiel passent avant tout. C’est rejoindre un groupe qui porte haut et fort ses valeurs, un groupe de pointe dans lequel les innovations servent l’humain et dont la réussite se mesure à la satisfaction de ses salariés et de ses assurés.

Aux Assurances du Crédit Mutuel, nos postes sont ouverts aux candidatures des personnes en situation de handicap.




































Société : ACM GIE | Réf. : A046422 | Date de publication : 22/02/2022",4.0,"ACM GIE
",Strasbourg,Plus de 10 000 employés,1882,Entreprise cotée en bourse,Banques et organismes de crédit,Finances,Plus de 10 milliards de dollars US,0,0,35,40,37.5,Strasbourg,140,0,1,0,0,0,0,0,0,0
Data Scientist (H/F) (IT),"Vous aurez donc les missions principales suivantes : 

 Analyse de l’existant et diagnostic sur la base des rapports existants

 Structuration et priorisation des étapes du projet Dashboard UX

 Identification des KPIs probants relatifs aux objectifs utilisateur et métier

 Conception du modèle de données de la Dataviz

 Animation des ateliers de conception des Dataviz

 Création du Dashboard UX

 Proposition des restitutions graphiques et visuelles pour améliorer le pilotage de l’activité UX dans l’outil de Dataviz

 Alimentation des données et enrichissement du Datamart

 Recensement des hypothèses identifiées

 Exploration des données pour confirmer ou infirmer les hypothèses relatives à l’expérience client

 Développement de la connaissance client par l’exploration des données et contribution à la création des Personae

 Formation et accompagnement des utilisateurs sur l’exploitation du Dashboard UX

 Contribution à la montée en compétences des équipes métiers",4.2,"CITECH
",Marseille,De 51 à 200 employés,2013,Cabinet / Société du secteur privé,Services informatiques,Informatique,Entre 1 et 5 millions de dollars US,0,0,35,40,37.5,Marseille,9,0,1,0,0,0,0,0,0,0
Data Analyst,"Participate in the definition and development of new concepts and tools used in the automatic processing and analysis of big data.
Report directly to the Dev lead and the project manager.
Gather and analyze customer requirements to propose solutions.
Analyze data documents
Do ontology modeling
Define modeling rules
Do documentation, architecture and automation",3.7,"umlaut AG
",Toulouse,De 1 001 à 5 000 employés,1996,Entreprise non cotée en bourse,Conseils,Services aux entreprises,Ne sait pas / non applicable,0,0,35,40,37.5,Toulouse,26,0,1,0,0,1,0,0,0,0
Blockchain Data Scientist,"Ledger is one of the fastest growing tech companies in France, part of the Next40, and already a global leader in crypto asset security. Within the Blockchain Analytics Department, the blockchain data scientist is in charge of extracting meaningful insights and recommendations from blockchain data to drive business & strategic decisions on both our consumer and our B2B business.

The Blockchain Data Scientist role requires a blend of data engineering and data science skills. In this role, you will use modern processing and statistical techniques to derive insights and recommendations in an ever-changing market.
In this role, you will:",4.6,"Ledger
",Paris,Entre 201 et 500 employés,2014,Entreprise non cotée en bourse,Matériel et logiciels informatiques,Informatique,Entre 50 et 100 millions de dollars US,0,0,35,40,37.5,Paris,8,0,0,0,0,0,1,0,0,0
Data Scientist F/H,"Data Scientist F/H
Ref. Apec : 167733002W
SAS RECHERCHES ET HORIZONS
1
CDI
Montpellier - 34
Publiée le 24/02/2022
Actualisée le 25/02/2022
Salaire
50 - 70 k€ brut annuel",4.9,"SAS RECHERCHES ET HORIZONS
",Montpellier,De 1 à 50 employés,2014,Entreprise non cotée en bourse,Recrutement et sous-traitance,Services aux entreprises,Ne sait pas / non applicable,0,0,35,40,37.5,Montpellier,8,0,1,0,0,0,0,0,0,0
Senior Data Scientist,"ABOUT ALORSFAIM
Founded in 2018 and headquartered in Paris, ALORSFAIM is a one-stop service platform that uses internet technology and big data as its core drivers to provide online restaurant takeaways, grocery delivery and other life services to consumers. Following our successful seed-round fundraising in 2021, our ambition is to becoming the most recognised brand for online superstore and food delivery service in the Asian community in Europe.
The members of our core leading team all graduated from elite European and American universities or engineering schools. They are skilled investors and serial entrepreneurs and have multiple international working experiences in the U.S., Europe and other countries.",-1.0,Alorsfaim,Thiais,-1,-1,-1,-1,-1,-1,0,0,35,40,37.5,Thiais,-1,0,1,0,0,1,0,0,0,0
#AGGP – Graduate Digital Master Data & Controlling Data Analyst (M/F),"Job Description:
Start date October 3rd 2022
Every year we look for university graduates from around the world to join Airbus. We need people with the aspiration, enthusiasm and the talent to help us move forward and to change the world and deliver our vision to pioneer sustainable aerospace for a safe and united world.
When you begin your career with us, we accelerate your development through our Airbus Global Graduate Experience. You are part of a 2 year programme where you develop your professional skills, build your networks, locally and internationally, and gain a unique perspective on the world of Airbus. You are part of a global community, so we bring you together once a year for a global graduate conference where you meet your peers, hear from our leaders and learn from the best.
We are hiring the graduates we need to fill the critical roles for our future.
AIRBUS SAS
Permanent Contract / CDI / Unbefristet / Contrato indefinido
Entry Level / Débutant / Anfänger / Recién titulado
Financial Expertise <JF-FI-FE>",3.9,"Airbus
",Toulouse,Plus de 10 000 employés,1970,Entreprise cotée en bourse,Aérospatiale et Défense,Aérospatiale et Défense,Plus de 10 milliards de dollars US,0,0,35,40,37.5,Toulouse,52,0,1,0,0,0,0,0,0,0
Data Scientist H/F,"Description de l'entreprise
Open Mind Neurotechnologies is a 5-year-old French startup dedicated to develop wellbeing and healthcare applications for the general public using virtual reality (VR), serious gaming and quantitative neurophysiology.
Our services offer a complete suite of assessments and personal development tools. It uses online psychometric questionnaires and serious games, as well as physiological and behavioral measurements taken during immersive experiences to quantify several dimensions of mental health in a dynamical approach.
Open Mind gathers a multidisciplinary team of 15 people:",-1.0,Open Mind Neurotechnologie,Paris,-1,-1,-1,-1,-1,-1,0,0,35,40,37.5,Paris,-1,0,1,0,0,0,0,0,0,0
Data analyst / Data scientist / Freelance,"Intitulé de la mission : Data analyst / Data scientist Contexte : En relation directe avec les traders et les développeurs des automates de trading. Mission : Traitement de données : - Import - Cleaning - Processing Prérequis : - Bonne connaissance techniques en Python (Pandas, Numpy, Sklearn, Tensorflow, Jupyter Notebook) et plus généralement solides bases IT et idéalement des connaissances en C# - Anglais/français - Capacité à comprendre rapidement les instruments financiers Bonds, swaps, futurs, options - Réactivité, capacité à s'intégrer à un environnement front office exigeant et à échanger directement avec les traders",-1.0,Ela Technology,Île-de-France,Inconnu,2017,Entreprise non cotée en bourse,-1,-1,-1,0,0,35,40,37.5,Île-de-France,5,1,1,0,0,0,0,0,0,0
Data Analyst / Freelance,"Poste : Data Analyst MISSIONS Edition des rapports de campagnes publicitaires (Excel) Analyse des données de campagnes publicitaires (résultats, KPI, insights...) Analyse des données du traffic on-site et lead (sessions, RDV ) Analyse des données user-centric (comportements utilisateurs) via ContentSquare et outil AB Testing Gestion de la data collectée au travers d'outils de gestion de leads et d'une nouvelle CDP. Recommandations trimestrielles sur l'amélioration de l'expérience digitale. PROFIL RECHERCHÉ Vous avez 3 + ans d'expérience Anglais écrit/oral (bon niveau) Vous aimez les tâches analytiques Vous êtes organisé.e et rigoureux.se Vous avez le goût de l'innovation Vous êtes à l'aise avec Excel Des connaissances ou certificats GA et ContentSquare sont essentielles Des connaissances sur AB Tasty, et/ou Kameleoon sont un plus Des connaissances VBA & SQL sont un plus",3.8,"SOFTEAM
",Paris,De 1 001 à 5 000 employés,1989,Entreprise non cotée en bourse,Services informatiques,Informatique,Entre 100 et 500 millions de dollars US,0,0,35,40,37.5,Paris,33,0,1,1,0,0,0,0,0,0
